{
  "schema": "aubreys-menu/1",
  "store": {
    "locId": 12,
    "code": "12",
    "name": "Bluetick Tavern",
    "concept": "bluetick",
    "theme": "bluetick",
    "homeUrl": "https://www.blueticktavern.com"
  },
  "generatedAt": "2026-10-16T20:05:21Z",
  "contentChangedAt": "2026-10-16T20:05:21Z",
  "sourceExportAt": "2026-10-16T19:54:22Z",
  "itemCount": 307,
  "groups": [
    {
      "code": "beer",
      "name": "Beer",
      "sections": [
        {
          "code": "draft_beer",
          "name": "Draft Beer",
          "servings": [
            {
              "code": "all",
              "name": null,
              "items": [
                {
                  "id": 2020269,
                  "name": "$4 Modelo Especial",
                  "price": 4.0,
                  "attributes": []
                },
                {
                  "id": 2020396,
                  "name": "Abridged Haute Couture",
                  "price": 8.0,
                  "attributes": []
                },
                {
                  "id": 2020395,
                  "name": "Abridged Toppy Rock",
                  "price": 7.0,
                  "attributes": []
                },
                {
                  "id": 2020013,
                  "name": "Austin East Blood Orange",
                  "price": 7.0,
                  "attributes": []
                },
                {
                  "id": 2020029,
                  "name": "BH Vanilla Cream",
                  "price": 6.5,
                  "attributes": []
                },
                {
                  "id": 2020035,
                  "name": "BR Blackberry",
                  "price": 6.0,
                  "attributes": []
                },
                {
                  "id": 2020380,
                  "name": "Band Beer",
                  "price": 2.5,
                  "attributes": []
                },
                {
                  "id": 2020341,
                  "name": "Blackstone",
                  "price": 7.0,
                  "attributes": []
                },
                {
                  "id": 2020032,
                  "name": "Blue Moon",
                  "price": 7.0,
                  "attributes": []
                },
                {
                  "id": 2020034,
                  "name": "Bold Rock",
                  "price": 6.0,
                  "attributes": []
                },
                {
                  "id": 2020510,
                  "name": "Bold Rock Paradise Orchard",
                  "price": 6.5,
                  "attributes": []
                },
                {
                  "id": 2020040,
                  "name": "Bud Light",
                  "price": 5.0,
                  "attributes": []
                },
                {
                  "id": 2020045,
                  "name": "Busch Light",
                  "price": 3.5,
                  "attributes": []
                },
                {
                  "id": 2020356,
                  "name": "CC Classic City",
                  "price": 7.0,
                  "attributes": []
                },
                {
                  "id": 2020446,
                  "name": "CC Flash Cat IPA",
                  "price": 8.0,
                  "attributes": []
                },
                {
                  "id": 2020051,
                  "name": "CC Jai Alai",
                  "price": 7.0,
                  "attributes": []
                },
                {
                  "id": 80,
                  "name": "Calfkiller The Golden Calf",
                  "price": 5.5,
                  "attributes": []
                },
                {
                  "id": 2020261,
                  "name": "Cigar City Maduro Brown Ale",
                  "price": 6.0,
                  "attributes": []
                },
                {
                  "id": 2020062,
                  "name": "Coors Banquet",
                  "price": 3.5,
                  "attributes": []
                },
                {
                  "id": 2020064,
                  "name": "Coors Light",
                  "price": 5.0,
                  "attributes": []
                },
                {
                  "id": 2020582,
                  "name": "Crafty Bastard Porter",
                  "price": 7.0,
                  "attributes": []
                },
                {
                  "id": 2020600,
                  "name": "Creature Comforts Watermelon",
                  "price": 7.0,
                  "attributes": []
                },
                {
                  "id": 2020437,
                  "name": "Dogfish Grateful Dead",
                  "price": 7.0,
                  "attributes": []
                },
                {
                  "id": 2020086,
                  "name": "Golden Road Mango Cart",
                  "price": 7.0,
                  "attributes": []
                },
                {
                  "id": 2020087,
                  "name": "Guinness",
                  "price": 7.0,
                  "attributes": []
                },
                {
                  "id": 2020091,
                  "name": "Gypsy Circus Queen of Swords",
                  "price": 7.0,
                  "attributes": []
                },
                {
                  "id": 2020573,
                  "name": "Hi-Wire Pink Lemonade",
                  "price": 6.5,
                  "attributes": []
                },
                {
                  "id": 2020098,
                  "name": "Highland Clawhammer",
                  "price": 7.0,
                  "attributes": []
                },
                {
                  "id": 2020100,
                  "name": "Highland Gaelic",
                  "price": 6.5,
                  "attributes": []
                },
                {
                  "id": 2020102,
                  "name": "Highland Oatmeal Porter",
                  "price": 7.0,
                  "attributes": []
                },
                {
                  "id": 2020553,
                  "name": "Highland St Terese",
                  "price": 6.5,
                  "attributes": []
                },
                {
                  "id": 2020108,
                  "name": "Honky Tonk Blueberry Lemonade",
                  "price": 7.0,
                  "attributes": []
                },
                {
                  "id": 2020122,
                  "name": "Kentucky Bourbon Barrel",
                  "price": 9.5,
                  "attributes": []
                },
                {
                  "id": 2020132,
                  "name": "Michelob Ultra",
                  "price": 5.0,
                  "attributes": []
                },
                {
                  "id": 2020134,
                  "name": "Miller Lite",
                  "price": 5.0,
                  "attributes": []
                },
                {
                  "id": 2020136,
                  "name": "Modelo Especial",
                  "price": 6.0,
                  "attributes": []
                },
                {
                  "id": 2020150,
                  "name": "Oskar Hazy Blues",
                  "price": 6.0,
                  "attributes": []
                },
                {
                  "id": 2020158,
                  "name": "Sam Adams Seasonal",
                  "price": 6.0,
                  "attributes": []
                },
                {
                  "id": 2020159,
                  "name": "Schulz Brau Dunkel",
                  "price": 7.0,
                  "attributes": []
                },
                {
                  "id": 2020165,
                  "name": "Shiner Bock",
                  "price": 5.0,
                  "attributes": []
                },
                {
                  "id": 2020170,
                  "name": "Sierra Nevada Hazy Little Thing",
                  "price": 6.5,
                  "attributes": []
                },
                {
                  "id": 2020181,
                  "name": "Sweetwater Blue",
                  "price": 6.5,
                  "attributes": []
                },
                {
                  "id": 2020190,
                  "name": "TN Brewworks Hippies & Cowboys",
                  "price": 7.5,
                  "attributes": []
                },
                {
                  "id": 2020463,
                  "name": "Tri Hop Red Ale",
                  "price": 7.0,
                  "attributes": []
                },
                {
                  "id": 2020206,
                  "name": "Wicked Weed Pernicious",
                  "price": 7.5,
                  "attributes": []
                },
                {
                  "id": 2020216,
                  "name": "XUL PB&J Mixtape",
                  "price": 10.0,
                  "attributes": []
                },
                {
                  "id": 2020215,
                  "name": "XUL Paper Crowns",
                  "price": 7.0,
                  "attributes": []
                },
                {
                  "id": 2020217,
                  "name": "XUL Toro Y Oso",
                  "price": 6.0,
                  "attributes": []
                },
                {
                  "id": 2020225,
                  "name": "Yuengling Traditional Lager",
                  "price": 5.0,
                  "attributes": []
                },
                {
                  "id": 2020054,
                  "name": "ZZ_CC Tropicalia DNU",
                  "price": 6.5,
                  "attributes": []
                }
              ]
            }
          ]
        },
        {
          "code": "bottled_beer",